{
  "schema_version": "1.0.0",
  "slice_id": "world-slice-leonardo-romagna-1502-v1",
  "status": "CLAIM_CURATION_IN_PROGRESS",
  "claims": [
    {
      "claim_id": "claim-rimini-presence-1502-08-08",
      "statement": "Leonardo recorded an observation in Rimini dated 8 August 1502.",
      "target_object_ref": "event-leonardo-rimini-note",
      "claim_kind": "factual",
      "origin": "curator",
      "review_state": "draft",
      "confidence": "unknown",
      "confidence_basis": "Urbino University Press binds the dated observation to Manuscript L folio 78r; independent evidence review is still pending.",
      "evidence_state": "missing",
      "evidence_link_refs": ["evidence-rimini-visit-romagna", "evidence-rimini-uniurb-f78r"],
      "uncertainty_refs": ["uncertainty-manuscript-folio-binding", "uncertainty-live-page-drift"]
    },
    {
      "claim_id": "claim-cesena-presence-1502-08-10",
      "statement": "Leonardo was present in Cesena by 10 August 1502 in the selected survey context.",
      "target_object_ref": "event-leonardo-cesena-survey",
      "claim_kind": "factual",
      "origin": "curator",
      "review_state": "draft",
      "confidence": "unknown",
      "confidence_basis": "Urbino University Press binds the 10 August Cesena entry to Manuscript L folio 46v; independent evidence review is still pending.",
      "evidence_state": "missing",
      "evidence_link_refs": ["evidence-cesena-visit-romagna", "evidence-cesena-ms-l-context", "evidence-cesena-uniurb-f46v"],
      "uncertainty_refs": ["uncertainty-manuscript-folio-binding", "uncertainty-live-page-drift"]
    },
    {
      "claim_id": "claim-cesena-survey-folios-9r-10r",
      "statement": "The selected Cesena survey context is associated with Manuscript L folios 9r through 10r.",
      "target_object_ref": "event-leonardo-cesena-survey",
      "claim_kind": "factual",
      "origin": "curator",
      "review_state": "rejected",
      "confidence": "low",
      "confidence_basis": "The institutional itinerary names folios 9r, 9v and 10r, but the frozen source set has no critical-edition locator or rights-compliant facsimile that independently verifies this separate wall-survey association. It is rejected from the Gate C supported Claim set without asserting that the association is historically false.",
      "evidence_state": "missing",
      "evidence_link_refs": ["evidence-cesena-folios-visit-romagna", "evidence-ms-l-institutional-record"],
      "uncertainty_refs": ["uncertainty-manuscript-folio-binding"]
    },
    {
      "claim_id": "claim-patent-date-1502-08-18",
      "statement": "Cesare Borgia's letter patent for Leonardo is dated 18 August 1502.",
      "target_object_ref": "event-leonardo-borgia-patent",
      "claim_kind": "factual",
      "origin": "curator",
      "review_state": "draft",
      "confidence": "unknown",
      "confidence_basis": "The university chronology reproduces the full patent text and dating formula at printed p. 16 n. 26; independent evidence review is still pending.",
      "evidence_state": "missing",
      "evidence_link_refs": ["evidence-patent-visit-romagna", "evidence-patent-rct-context", "evidence-patent-uniurb-p16-n26"],
      "uncertainty_refs": ["uncertainty-patent-original-custody", "uncertainty-live-page-drift"]
    },
    {
      "claim_id": "claim-cesenatico-presence-1502-09-06",
      "statement": "Leonardo recorded the Cesenatico port context on 6 September 1502.",
      "target_object_ref": "event-leonardo-cesenatico-port-note",
      "claim_kind": "factual",
      "origin": "curator",
      "review_state": "draft",
      "confidence": "unknown",
      "confidence_basis": "Urbino University Press binds the dated Cesenatico entry to Manuscript L folio 66v; independent evidence review is still pending.",
      "evidence_state": "missing",
      "evidence_link_refs": ["evidence-cesenatico-visit-romagna", "evidence-cesenatico-ms-l-context", "evidence-cesenatico-uniurb-f66v"],
      "uncertainty_refs": ["uncertainty-manuscript-folio-binding", "uncertainty-live-page-drift"]
    },
    {
      "claim_id": "claim-cesenatico-dated-folio-66v",
      "statement": "The selected dated Cesenatico port entry is associated with Manuscript L folio 66v.",
      "target_object_ref": "event-leonardo-cesenatico-port-note",
      "claim_kind": "factual",
      "origin": "curator",
      "review_state": "draft",
      "confidence": "unknown",
      "confidence_basis": "The university chronology transcribes the dated entry and identifies folio 66v; folio 68r is not used as evidence for the exact date.",
      "evidence_state": "missing",
      "evidence_link_refs": ["evidence-cesenatico-folio-66v-uniurb", "evidence-ms-l-record-for-66v"],
      "uncertainty_refs": ["uncertainty-manuscript-folio-binding"]
    },
    {
      "claim_id": "claim-imola-map-work-autumn-1502",
      "statement": "Royal Collection item 912284 associates Leonardo's Imola map with his autumn 1502 work context.",
      "target_object_ref": "event-leonardo-imola-map-context",
      "claim_kind": "factual",
      "origin": "curator",
      "review_state": "draft",
      "confidence": "unknown",
      "confidence_basis": "Specific collection item candidate; the exact supporting catalogue passage still requires review.",
      "evidence_state": "missing",
      "evidence_link_refs": ["evidence-imola-map-rct"],
      "uncertainty_refs": ["uncertainty-imola-autumn-range", "uncertainty-live-page-drift"]
    },
    {
      "claim_id": "claim-imola-street-sketch-source-object",
      "statement": "Royal Collection item 912686 catalogues Leonardo's sketches of the street plan of Imola.",
      "target_object_ref": "event-leonardo-imola-map-context",
      "claim_kind": "factual",
      "origin": "curator",
      "review_state": "draft",
      "confidence": "unknown",
      "confidence_basis": "The collection identity is stable, but the source object has not been reviewed for historical geometry use.",
      "evidence_state": "missing",
      "evidence_link_refs": ["evidence-imola-sketches-rct"],
      "uncertainty_refs": ["uncertainty-romagna-region-reconstruction", "uncertainty-live-page-drift"]
    },
    {
      "claim_id": "claim-leonardo-borgia-service-1502",
      "statement": "The selected sources describe Leonardo as serving Cesare Borgia in an engineering capacity during 1502.",
      "target_object_ref": "state-leonardo-in-borgia-service",
      "claim_kind": "factual",
      "origin": "curator",
      "review_state": "draft",
      "confidence": "unknown",
      "confidence_basis": "The published patent transcription supports the commissioned title; the exact end of the State and original-document custody locator remain unresolved.",
      "evidence_state": "missing",
      "evidence_link_refs": ["evidence-service-ms-l", "evidence-service-rct", "evidence-service-visit-romagna", "evidence-service-uniurb-patent"],
      "uncertainty_refs": ["uncertainty-patent-original-custody", "uncertainty-service-end-validity"]
    },
    {
      "claim_id": "claim-safavid-isma-il-i-1501-1524",
      "statement": "The Metropolitan Museum of Art chronology dates the rule of Isma'il I to 1501 through 1524.",
      "target_object_ref": "state-safavid-isma-il-i",
      "claim_kind": "factual",
      "origin": "curator",
      "review_state": "draft",
      "confidence": "unknown",
      "confidence_basis": "Specific institutional chronology entry; content review has not yet occurred.",
      "evidence_state": "missing",
      "evidence_link_refs": ["evidence-safavid-met"],
      "uncertainty_refs": ["uncertainty-live-page-drift", "uncertainty-global-coverage"]
    }
  ],
  "evidence_links": [
    {
      "evidence_link_id": "evidence-rimini-visit-romagna",
      "claim_id": "claim-rimini-presence-1502-08-08",
      "source_id": "source-visit-romagna-leonardo-borgia",
      "locator": "Section Rimini; paragraph containing the dated 8 August 1502 observation",
      "relation_to_claim": "supports",
      "evidence_strength": "indirect",
      "review_state": "draft",
      "reviewer": null
    },
    {
      "evidence_link_id": "evidence-rimini-uniurb-f78r",
      "claim_id": "claim-rimini-presence-1502-08-08",
      "source_id": "source-uniurb-volpe-chronology",
      "locator": "Printed p. 16; chronological entry transcribing the 8 August 1502 Rimini note and identifying Manuscript L folio 78r",
      "relation_to_claim": "supports",
      "evidence_strength": "direct",
      "review_state": "draft",
      "reviewer": null
    },
    {
      "evidence_link_id": "evidence-cesena-visit-romagna",
      "claim_id": "claim-cesena-presence-1502-08-10",
      "source_id": "source-visit-romagna-leonardo-borgia",
      "locator": "Section Cesena; opening paragraph dating presence to 10 August 1502",
      "relation_to_claim": "supports",
      "evidence_strength": "indirect",
      "review_state": "draft",
      "reviewer": null
    },
    {
      "evidence_link_id": "evidence-cesena-ms-l-context",
      "claim_id": "claim-cesena-presence-1502-08-10",
      "source_id": "source-museo-galileo-ms-l",
      "locator": "Institutional record key 100790; 1502 military-technology and architecture summary",
      "relation_to_claim": "contextualizes",
      "evidence_strength": "background",
      "review_state": "draft",
      "reviewer": null
    },
    {
      "evidence_link_id": "evidence-cesena-uniurb-f46v",
      "claim_id": "claim-cesena-presence-1502-08-10",
      "source_id": "source-uniurb-volpe-chronology",
      "locator": "Printed p. 16; chronological entry transcribing the 10 August 1502 Cesena note and identifying Manuscript L folio 46v",
      "relation_to_claim": "supports",
      "evidence_strength": "direct",
      "review_state": "draft",
      "reviewer": null
    },
    {
      "evidence_link_id": "evidence-cesena-folios-visit-romagna",
      "claim_id": "claim-cesena-survey-folios-9r-10r",